{
  "$schema": "../schema/benchmark.schema.json",
  "id": "CP_LQR_FIN_UNR_SAFE",
  "description": "Cart-pole with LQR feedback (4D), finite horizon: the pole-tip coordinate x1 + sin(x3) never reaches 1.7 inside the box [-1,1]^3 x [-2.5,2.5].",
  "notes": [
    "The initial set is a single state (degenerate box).",
    "State x = (p, v, theta, omega): cart position and velocity, pole angle and angular velocity. u = -K x is the LQR state feedback (gains k1..k4); with these parameters the equations equal the previous inline form.",
    "The target is restricted to the box [-1,1]^3 x [-2.5,2.5], which lies in the basin of attraction of the LQR equilibrium (needed by eigenfunction-based methods); the unrestricted pole-tip region extends to states that do not converge."
  ],
  "system": {
    "type": "nonlinear",
    "parameters": {
      "m_c": 3,
      "m_p": 2,
      "l": 1,
      "g": 9.8065,
      "k1": 3.16227766016837,
      "k2": 6.69810360685677,
      "k3": 5.02657663490373,
      "k4": 1.6165296244068
    },
    "definitions": {
      "u": "-(k1*x1 + k2*x2 + k3*x3 + k4*x4)"
    },
    "equations": ["x2", "(u + m_p*sin(x3)*(l*x4^2 - g*cos(x3)))/(m_c + m_p*sin(x3)^2)", "x4", "(u*cos(x3) + m_p*l*x4^2*sin(x3)*cos(x3) - (m_c + m_p)*g*sin(x3))/(l*(m_c + m_p*sin(x3)^2))"]
  },
  "domain": [
    [-5.0, 5.0],
    [-5.0, 5.0],
    [-3.14159, 3.14159],
    [-10.0, 10.0]
  ],
  "initial_sets": [
    {
      "type": "box",
      "bounds": [
        [0.8, 0.8],
        [0.3, 0.3],
        [-0.785398, -0.785398],
        [0.2, 0.2]
      ]
    }
  ],
  "target_sets": [
    {
      "type": "level_set",
      "function": "1.7 - x1 - sin(x3)",
      "bounding_box": [
        [-1, 1],
        [-1, 1],
        [-1, 1],
        [-2.5, 2.5]
      ]
    }
  ],
  "time_horizon": [0.0, 10.0],
  "expected_result": "unreachable",
  "visualization": {
    "dims": [
      [0, 1],
      [2, 3]
    ]
  }
}
