{
  "$schema": "../schema/benchmark.schema.json",
  "id": "NL_EIG_FIN_BACKWARD_REA_BOX",
  "description": "Nonlinear system with known Koopman eigenfunctions (2D), backward reachability over a finite horizon, reachable, box sets.",
  "notes": ["Backward reachability benchmark: trajectories follow the time-reversed flow dx/dt = -f(x) from initial_sets. It shows that eigenfunction-based reach-time bounds handle backward problems by negating the eigenvalues (the eigenfunctions of -f are those of f). It is equivalent to the forward problem with initial_sets and target_sets exchanged."],
  "system": {
    "type": "nonlinear",
    "equations": ["((7.5*x2^2 + 5.0)*(x1^3 + x1 + sin(x2)) + (1.0*x1^2 + 1.0*x2^3 + 2.0*x2)*cos(x2))/(9*x1^2*x2^2 + 6*x1^2 - 2*x1*cos(x2) + 3*x2^2 + 2)", "(-5.0*x1*(x1^3 + x1 + sin(x2)) - 1.0*(3*x1^2 + 1)*(x1^2 + x2^3 + 2*x2))/(9*x1^2*x2^2 + 6*x1^2 - 2*x1*cos(x2) + 3*x2^2 + 2)"]
  },
  "direction": "backward",
  "domain": [
    [-1.0, 3.0],
    [-2.0, 2.0]
  ],
  "initial_sets": [
    {
      "type": "box",
      "bounds": [
        [1.8, 1.9],
        [-0.8, -0.7]
      ]
    }
  ],
  "target_sets": [
    {
      "type": "box",
      "bounds": [
        [0, 0.1],
        [1.1, 1.2]
      ]
    }
  ],
  "time_horizon": [0.0, 1.3],
  "expected_result": "reachable",
  "visualization": {
    "dims": [
      [0, 1]
    ]
  }
}
