{
  "$schema": "../schema/benchmark.schema.json",
  "id": "MAS_CON_FIN_REA_BOX",
  "description": "Multi-agent consensus (16D), finite horizon, reachable: the agents synchronise into a box around the origin.",
  "system": {
    "type": "nonlinear",
    "equations": ["-0.441936617444625*x1 - 0.1*(0.779918792240115*sin(x1 - x2) + 0.438409231440893*sin(x1 - x3) + 0.723465177830941*sin(x1 - x4) + 0.538495870410434*sin(x1 - x6) + 0.935902550688138*tanh(x1 - x2) + 0.526091077729072*tanh(x1 - x3) + 0.868158213397129*tanh(x1 - x4) + 0.64619504449252*tanh(x1 - x6))/(1 + exp(-x1))", "-0.441936617444625*x2 - 0.1*(-0.268438980101871*sin(x1 - x2) + 0.803739036104375*sin(x2 - x4) + 0.0659363469059051*sin(x2 - x6) + 0.288145599307994*sin(x2 - x7) + 0.909593527719614*sin(x2 - x8) - 0.322126776122245*tanh(x1 - x2) + 0.96448684332525*tanh(x2 - x4) + 0.0791236162870861*tanh(x2 - x6) + 0.345774719169592*tanh(x2 - x7) + 1.09151223326354*tanh(x2 - x8))/(1 + exp(-x2))", "-0.441936617444625*x3 - 0.1*(-0.213385353579916*sin(x1 - x3) + 0.024899227550348*sin(x3 - x4) + 0.230302879020965*sin(x3 - x7) - 0.256062424295899*tanh(x1 - x3) + 0.0298790730604176*tanh(x3 - x4) + 0.276363454825158*tanh(x3 - x7))/(1 + exp(-x3))", "-0.441936617444625*x4 - 0.1*(-0.909128374886731*sin(x1 - x4) - 0.13316944575925*sin(x2 - x4) - 0.523412580673766*sin(x3 - x4) + 0.669013240883914*sin(x4 - x5) + 0.49076588909107*sin(x4 - x8) - 1.09095404986408*tanh(x1 - x4) - 0.1598033349111*tanh(x2 - x4) - 0.628095096808519*tanh(x3 - x4) + 0.802815889060697*tanh(x4 - x5) + 0.588919066909285*tanh(x4 - x8))/(1 + exp(-x4))", "-0.441936617444625*x5 - 0.1*(-0.837917994309261*sin(x4 - x5) + 0.313994677212662*sin(x5 - x6) + 0.572625332643954*sin(x5 - x7) - 1.00550159317111*tanh(x4 - x5) + 0.376793612655195*tanh(x5 - x6) + 0.687150399172745*tanh(x5 - x7))/(1 + exp(-x5))", "-0.441936617444625*x6 - 0.1*(-0.4528429325464*sin(x1 - x6) - 0.352978365944395*sin(x2 - x6) - 0.459092977891431*sin(x5 - x6) + 0.412991829113835*sin(x6 - x7) - 0.54341151905568*tanh(x1 - x6) - 0.423574039133274*tanh(x2 - x6) - 0.550911573469718*tanh(x5 - x6) + 0.495590194936602*tanh(x6 - x7))/(1 + exp(-x6))", "-0.441936617444625*x7 - 0.1*(-0.741118872913264*sin(x2 - x7) - 0.42237404364314*sin(x3 - x7) - 0.634379868633839*sin(x5 - x7) - 0.522906201028345*sin(x6 - x7) + 0.00142688056275819*sin(x7 - x8) - 0.889342647495917*tanh(x2 - x7) - 0.506848852371768*tanh(x3 - x7) - 0.761255842360607*tanh(x5 - x7) - 0.627487441234014*tanh(x6 - x7) + 0.00171225667530983*tanh(x7 - x8))/(1 + exp(-x7))", "-0.441936617444625*x8 - 0.1*(-0.709394393725213*sin(x2 - x8) - 0.696160463516969*sin(x4 - x8) - 0.0531286906729576*sin(x7 - x8) - 0.851273272470255*tanh(x2 - x8) - 0.835392556220363*tanh(x4 - x8) - 0.0637544288075491*tanh(x7 - x8))/(1 + exp(-x8))", "-0.441936617444625*x9 - 0.1*(-0.964970999536127*sin(x11 - x9) - 0.945048223792794*sin(x12 - x9) - 0.472323996288402*sin(x14 - x9) + 0.235120407257464*sin(x9 - x10) - 1.15796519944335*tanh(x11 - x9) - 1.13405786855135*tanh(x12 - x9) - 0.566788795546083*tanh(x14 - x9) + 0.282144488708957*tanh(x9 - x10))/(1 + exp(-x9))", "-0.441936617444625*x10 - 0.1*(-0.485825228708897*sin(x12 - x10) - 0.343536529704358*sin(x14 - x10) - 0.324426169672443*sin(x15 - x10) - 0.30041890431804*sin(x16 - x10) - 0.308733657297835*sin(x9 - x10) - 0.582990274450676*tanh(x12 - x10) - 0.41224383564523*tanh(x14 - x10) - 0.389311403606932*tanh(x15 - x10) - 0.360502685181648*tanh(x16 - x10) - 0.370480388757402*tanh(x9 - x10))/(1 + exp(-x10))", "-0.441936617444625*x11 - 0.1*(0.774900375814017*sin(x11 - x12) + 0.460630296163277*sin(x11 - x15) + 0.165501400465787*sin(x11 - x9) + 0.929880450976821*tanh(x11 - x12) + 0.552756355395932*tanh(x11 - x15) + 0.198601680558945*tanh(x11 - x9))/(1 + exp(-x11))", "-0.441936617444625*x12 - 0.1*(-0.800479048998464*sin(x11 - x12) + 0.0406558094366858*sin(x12 - x13) + 0.475764499424244*sin(x12 - x16) + 0.887288951852735*sin(x12 - x9) + 0.674918769866788*sin(x12 - x10) - 0.960574858798156*tanh(x11 - x12) + 0.0487869713240229*tanh(x12 - x13) + 0.570917399309093*tanh(x12 - x16) + 1.06474674222328*tanh(x12 - x9) + 0.809902523840145*tanh(x12 - x10))/(1 + exp(-x12))", "-0.441936617444625*x13 - 0.1*(-0.658748258954145*sin(x12 - x13) + 0.357070628352879*sin(x13 - x14) + 0.812829550163706*sin(x13 - x15) - 0.790497910744975*tanh(x12 - x13) + 0.428484754023455*tanh(x13 - x14) + 0.975395460196448*tanh(x13 - x15))/(1 + exp(-x13))", "-0.441936617444625*x14 - 0.1*(-0.0071432752789985*sin(x13 - x14) + 0.463136218038147*sin(x14 - x15) + 0.599854437543446*sin(x14 - x9) + 0.728161283147134*sin(x14 - x10) - 0.00857193033479819*tanh(x13 - x14) + 0.555763461645777*tanh(x14 - x15) + 0.719825325052136*tanh(x14 - x9) + 0.87379353977656*tanh(x14 - x10))/(1 + exp(-x14))", "-0.441936617444625*x15 - 0.1*(-0.828453194996125*sin(x11 - x15) - 0.128147854002733*sin(x13 - x15) - 0.230430674410219*sin(x14 - x15) + 0.132473988816749*sin(x15 - x16) + 0.607770751443867*sin(x15 - x10) - 0.99414383399535*tanh(x11 - x15) - 0.153777424803279*tanh(x13 - x15) - 0.276516809292263*tanh(x14 - x15) + 0.158968786580098*tanh(x15 - x16) + 0.729324901732641*tanh(x15 - x10))/(1 + exp(-x15))", "-0.441936617444625*x16 - 0.1*(-0.782230151323778*sin(x12 - x16) - 0.532644804943674*sin(x15 - x16) + 0.574862587589149*sin(x16 - x10) - 0.938676181588534*tanh(x12 - x16) - 0.639173765932408*tanh(x15 - x16) + 0.689835105106979*tanh(x16 - x10))/(1 + exp(-x16))"]
  },
  "domain": [
    [-3.0, 3.0],
    [-3.0, 3.0],
    [-3.0, 3.0],
    [-3.0, 3.0],
    [-3.0, 3.0],
    [-3.0, 3.0],
    [-3.0, 3.0],
    [-3.0, 3.0],
    [-3.0, 3.0],
    [-3.0, 3.0],
    [-3.0, 3.0],
    [-3.0, 3.0],
    [-3.0, 3.0],
    [-3.0, 3.0],
    [-3.0, 3.0],
    [-3.0, 3.0]
  ],
  "initial_sets": [
    {
      "type": "box",
      "bounds": [
        [2.27569841, 2.47569841],
        [-1.22870703, -1.02870703],
        [-1.75449468, -1.55449468],
        [1.78350465, 1.98350465],
        [1.94591232, 2.14591232],
        [-1.61233555, -1.41233555],
        [-0.39235129, -0.19235129],
        [0.99616071, 1.19616071],
        [1.62672579, 1.82672579],
        [-1.75862347, -1.55862347],
        [0.72484481, 0.92484481],
        [1.4391773, 1.6391773],
        [0.1485706, 0.3485706],
        [-1.77641671, -1.57641671],
        [-2.42235598, -2.22235598],
        [-1.19233091, -0.99233091]
      ]
    }
  ],
  "target_sets": [
    {
      "type": "box",
      "bounds": [
        [-0.1, 0.1],
        [-0.1, 0.1],
        [-0.1, 0.1],
        [-0.1, 0.1],
        [-0.1, 0.1],
        [-0.1, 0.1],
        [-0.1, 0.1],
        [-0.1, 0.1],
        [-0.1, 0.1],
        [-0.1, 0.1],
        [-0.1, 0.1],
        [-0.1, 0.1],
        [-0.1, 0.1],
        [-0.1, 0.1],
        [-0.1, 0.1],
        [-0.1, 0.1]
      ]
    }
  ],
  "time_horizon": [0.0, 7],
  "expected_result": "reachable",
  "visualization": {
    "dims": [
      [0, 1],
      [2, 3],
      [4, 5],
      [6, 7],
      [8, 9],
      [10, 11],
      [12, 13],
      [14, 15]
    ]
  }
}
